{
  "key": "TASK-009",
  "title": "Chequeo de consistencia wiki ↔ GDD en CI",
  "description": "El GDD tiene tablas-resumen de unidades (§7) y de enemigos (§10) que duplican información de la wiki, con la advertencia explícita de que la wiki es la fuente canónica. Esa duplicación va a derivar en cuanto alguien edite un solo lado.\n\nAdemás hay invariantes del proyecto que hoy nadie verifica:\n- **Regla de diseño (CLAUDE.md §2):** todo enemigo responde qué roba, cómo lo roba y cómo se evita — es decir, `que_roba`, `como_roba` y `contramedida` no vacíos.\n- Todo `id` referenciado cruzadamente (el `arma_base` de una unidad, los `drops` de un enemigo contra la tabla de componentes de WIKI §3) debe existir.\n- Ninguna ficha con `TBD` puede estar en `estado: canon` sin justificación.\n- El índice navegable (`docs/wiki/README.md`) es generado: no puede estar desincronizado de la wiki.\n\nEl pipeline ya tiene el gancho: `--check` valida campos requeridos y sale con código distinto de 0 si hay errores. Falta extender las reglas y colgarlo de CI.",
  "acceptance_criteria": [
    "`--check` falla si un enemigo tiene `que_roba`, `como_roba` o `contramedida` vacíos.",
    "`--check` falla si un `arma_base` o un `drop` referencia un `id` que no existe en la wiki.",
    "`--check` falla si `docs/wiki/README.md` difiere de lo que produciría `--emit-index` (índice desincronizado).",
    "Existe un workflow de CI que corre `--check` en cada push y PR, y que falla el build cuando el chequeo falla.",
    "Las tablas del GDD §7 y §10 quedan verificadas contra la wiki, o bien se reemplazan por enlaces al índice para eliminar la duplicación."
  ],
  "status": "todo",
  "priority": "medium",
  "labels": [
    "pipeline",
    "docs",
    "ci"
  ],
  "assignee": null,
  "depends_on": [
    "TASK-004"
  ],
  "verification_tier": "tdd",
  "linked_commits": [],
  "linked_prs": [],
  "comments": [
    {
      "author": "orchestrator",
      "at": "2026-08-28T00:00:00Z",
      "body": "Sembrado en el andamiaje inicial de la wiki. Prioridad y dependencias reflejan el orden natural: primero se repara la fuente canónica, después se cierra diseño, después se implementa."
    },
    {
      "author": "orchestrator",
      "at": "2026-08-28T00:00:00Z",
      "body": "**Más fácil ahora, gracias a TASK-003:**\n- Ya no hay referencias colgadas: los 5 `arma_base` y los 4 edificios citados en `obtencion` tienen ficha, así que el chequeo cruzado puede empezar en verde en vez de nacer con una lista de excepciones.\n- `desbloquea` se volvió un contrato verificable a raíz del review: **solo ids**, `TBD` si lo que habilita no es ficha todavía, `n/a` si no habilita entidades. Es un tercer eje de referencias cruzadas además de `arma_base` y `drops`, y el esquema de §0 lo dice.\n- El chequeo de referencias que corrió el developer (arma_base + edificios + los 8 de GDD §6.2) es la base del validador; hoy vive fuera del repo, integrarlo a `--check` es este ticket.\n\n**Deuda que hereda (MINOR #4 del review de TASK-003):** `build_index` quedó con dos constructores de tabla en paralelo — `_table_section()`/`_cell()` para armas, edificios y oleadas, y las secciones de units/enemies todavía hardcodeadas en `wiki_to_resources.py:559-622`. Un cambio de columnas comunes hay que hacerlo en dos lugares. La migración es mecánica y el índice generado actual sirve de golden file para probar que no cambia nada — encaja acá, que ya toca el chequeo de sincronía del índice."
    },
    {
      "author": "orchestrator",
      "at": "2026-08-29T00:00:00Z",
      "body": "**El cambio de mecánica de v0.4 le agrega superficie a este chequeo.** Referencias cruzadas nuevas que el CI debería verificar:\n- `unidad.desbloqueo_objetivo` tiene que apuntar a un id de la tabla de objetivos (WIKI §8) o ser `n/a`/`TBD`.\n- `edificio.modo_noche` solo puede tomar los cuatro valores de §5.0; `prioridad_objetivo`, los tres de §5.0 punto 5 (o `n/a`).\n- `edificio.desbloquea` ahora referencia fichas de tipo `recurso` (`establo` → `vaca`, `granja` → `pasto`): el verificador de ids tiene que aceptar el tipo nuevo.\n- Las referencias `§N` internas de la wiki se renumeraron (backlog §7 → §10, más §8 y §9 nuevas). Un chequeo de anclas rotas evitaría que se pudran otra vez.\n- GDD ↔ wiki: los tiempos de robo (1-3 s / 2 s) están escritos en los dos documentos; que no se desincronicen."
    }
  ],
  "created_at": "2026-08-28T00:00:00Z",
  "updated_at": "2026-08-29T00:00:00Z",
  "jira_key": null
}
