{
  "key": "TASK-002",
  "title": "Cerrar las preguntas abiertas del GDD §13",
  "description": "Con §13 restaurada (TASK-001), tomar cada pregunta abierta y convertirla en una decisión registrada en el GDD, o en un ticket propio si necesita prototipo para resolverse.\n\nPreguntas ya identificables desde el texto que sí sobrevivió, y que hay que cerrar sí o sí:\n- **GDD §7:** ¿las armas alien son una clase nueva («Fusilero de plasma») o una mejora de equipo sobre el Pistolero? La propuesta en el documento es *mejora de equipo* (menos sprites, más combinatoria), y la ficha `pistolero` de la wiki ya la asume marcándola como pendiente de confirmar. Decidir y sincronizar ambos documentos.\n- **GDD §8.3:** nombre y ficción de los puntos de meta-progresión (¿«Renombre»? ¿«Recortes de periódico»?) y tamaño del árbol meta.\n- **GDD §9:** duración del ciclo lunar (¿cada 6–8 noches?) y si la luna llena coincide con hitos del escalado.\n- **GDD §5.1:** confirmar la decisión tentativa de economía sin oro.\n- **GDD §6.2:** los edificios están como «propuesta inicial — por definir en detalle».\n\nCada decisión cerrada sube la versión del GDD y, si toca entidades, se refleja en la wiki.",
  "acceptance_criteria": [
    "Cada pregunta de §13 queda en uno de tres estados explícitos en el GDD: decidida (con la decisión escrita), diferida al prototipo (con el ticket que la resuelve enlazado), o descartada.",
    "La pregunta de clase-nueva-vs-mejora-de-equipo queda decidida y la nota `pendiente de confirmar` de la ficha `pistolero` en `docs/WIKI.md` se actualiza para reflejarlo.",
    "El GDD sube de versión (v0.3 → v0.4) y el encabezado lo refleja.",
    "Ninguna decisión de balance numérico se toma acá: los valores siguen siendo `TBD` hasta TASK-005."
  ],
  "status": "todo",
  "priority": "high",
  "labels": [
    "docs",
    "diseno"
  ],
  "assignee": null,
  "depends_on": [
    "TASK-001"
  ],
  "verification_tier": "uat-only",
  "linked_commits": [],
  "linked_prs": [],
  "comments": [
    {
      "author": "orchestrator",
      "at": "2026-08-28T00:00:00Z",
      "body": "Sembrado en el andamiaje inicial de la wiki. Prioridad y dependencias reflejan el orden natural: primero se repara la fuente canónica, después se cierra diseño, después se implementa."
    }
  ],
  "created_at": "2026-08-28T00:00:00Z",
  "updated_at": "2026-08-28T00:00:00Z",
  "jira_key": null
}
